ID,BioProject,Title,State,Note,,group,type,16s/hong,Age,Make_phyloseq,source,barcode,Primer,region,paper,data ,sci.factor
ERP109659,PRJEB27564,Gut microbiota in Parkinson's disease: Temporal stability and relations to disease progression,此数据之前已经下载过,,,,,,,,,,,16S rRNA基因的V3-V4,,,
ERP019674,PRJEB17784,Functional implications of microbial and viral gut metagenome changes in early stage L-DOPA-naïve Parkinson’s disease patients,宏数据,,,,,,,,,,,,,,
no,,Intestinal Dysbiosis and Lowered Serum Lipopolysaccharide-Binding Protein in Parkinson’s Disease,没有数据,,,,,,,,,,,,,,
SRP103472,PRJNA381395,The nasal and gut microbiome in Parkinson's disease and idiopathic rapid eye movement sleep behavior disorder,没有分组,,,no,,,,,,,,,,,
ERP016332,"	PRJEB14674",Parkinson’s Disease and PD Medications Have Distinct Signatures of the Gut Microbiome,优先处理,,,yes,single,,,,,,FWD:GTGCCAGCMGCCGCGGTAA; REV:GGACTACHVGGGTWTCTAAT,16S rRNA v4,,,
SRP051477,PRJNA268515,Colonic bacterial composition in Parkinson's disease,没有数据,,,,,,,,,,,,,,
no,, Structural changes of gut microbiota in Parkinson’s disease and its correlation with clinical features,没有数据,,,,,,,,,,,,,,
no,,Alteration of the fecal microbiota in North-Eastern Han Chinese population with sporadic Parkinson’s disease,没有数据,,,,,,,,,,,,,,
no,,Gut microbiota in patients with Parkinson's disease in southern China,没有数据,,,,,,,,,,,,,,
no,,"Analysis of Gut Microbiota in Patients
with Parkinson’s Disease",没有数据,,,,,,,,,,,,,,
SRP110221,PRJNA391524,"Alteration of the fecal microbiota in Chinese patients with Parkinson’s
disease",无分组，很好的测试数据,,,no,paired,,,,,,,,,,
no,,Short chain fatty acids and gut microbiota differ between patients with Parkinson's disease and age-matched controls ,没有数据,,,,,,,,,,,,,,
no,,"A Pilot Microbiota Study in Parkinson’s Disease Patients versus Control Subjects, and Effects of FTY720 and FTY720-Mitoxy Therapies in Parkinsonian and Multiple System Atrophy Mouse Models",没有数据,,,,,,,,,,,,,,
SRP218926,PRJNA561023,Gut Microbiota Altered in Mild Cognitive Impairment Compared With Normal Cognition in Sporadic Parkinson's Disease,没有分组,,,no,,,,,,,,,,,
no,,"Gut Microbiome is Altered in Patients
with Alzheimer’s Disease",没有数据,,,,,,,,,,,,,,
no,,Gut microbiome alterations in Alzheimer’s disease,原文未下到,,,,,,,,,,,,,,
no,,"Intestinal microbiota composition in patients with amyotrophic lateral sclerosis
establishment of bacterial and archaeal communities analyses",没有数据,,,,,,,,,,,,,,
no,,The fecal microbiome of ALS patients,没有数据,,,,,,,,,,,,,,
no,,Evaluation of the Microbial Diversity in Amyotrophic Lateral Sclerosis Using High-Throughput Sequencing,没有数据,,,,,,,,,,,,,,
ERP115481, PRJEB32767,Potential roles of gut microbiome and metabolites in modulating ALS in mice,没有分组,,,no,,,,,,,,,,,
no,,Gut microbiota in Parkinson disease in a northern German cohort,原文未下到,,,,,,,,,,,,,,